{
  "schemaVersion": "1.0.0",
  "labId": "LAB-06",
  "runId": "fixture-06",
  "createdAt": "2026-08-31T10:00:00Z",
  "updatedAt": "2026-08-31T10:00:00Z",
  "status": "setup-complete",
  "context": {
    "cloud": "AzureCloud",
    "tenantId": "22222222-2222-4222-8222-222222222222",
    "subscriptionId": "11111111-1111-4111-8111-111111111111"
  },
  "acknowledgements": {
    "cost": false,
    "tenantChange": false
  },
  "inputs": {
    "location": "westeurope"
  },
  "checkpointStates": [
    {
      "checkpointId": "LAB06-CP01",
      "required": true,
      "status": "pass",
      "updatedAt": "2026-08-31T10:00:00Z",
      "message": "Fixture checkpoint passed."
    },
    {
      "checkpointId": "LAB06-CP02",
      "required": true,
      "status": "pass",
      "updatedAt": "2026-08-31T10:00:00Z",
      "message": "Fixture checkpoint passed."
    },
    {
      "checkpointId": "LAB06-CP03",
      "required": true,
      "status": "pass",
      "updatedAt": "2026-08-31T10:00:00Z",
      "message": "Fixture checkpoint passed."
    },
    {
      "checkpointId": "LAB06-CP04",
      "required": true,
      "status": "pass",
      "updatedAt": "2026-08-31T10:00:00Z",
      "message": "Fixture checkpoint passed."
    },
    {
      "checkpointId": "LAB06-CP05",
      "required": true,
      "status": "pass",
      "updatedAt": "2026-08-31T10:00:00Z",
      "message": "Fixture checkpoint passed."
    }
  ],
  "managedObjects": [
    {
      "checkpointId": "LAB06-CP01",
      "kind": "azure-resource",
      "id": "/subscriptions/11111111-1111-4111-8111-111111111111/resourceGroups/rg-az104-l06-fixture-06/providers/Microsoft.Resources/deployments/cp1",
      "name": "fixture-06-1",
      "type": "Microsoft.Resources/deployments",
      "scope": null,
      "ownership": {
        "method": "manifest-id-and-tags",
        "expectedTags": {
          "purpose": "az104-lab",
          "labId": "06",
          "runId": "fixture-06"
        }
      },
      "recordedAt": "2026-08-31T10:00:00Z",
      "lifecycleStatus": "active"
    },
    {
      "checkpointId": "LAB06-CP02",
      "kind": "azure-resource",
      "id": "/subscriptions/11111111-1111-4111-8111-111111111111/resourceGroups/rg-az104-l06-fixture-06/providers/Microsoft.Resources/deployments/cp2",
      "name": "fixture-06-2",
      "type": "Microsoft.Resources/deployments",
      "scope": null,
      "ownership": {
        "method": "manifest-id-and-tags",
        "expectedTags": {
          "purpose": "az104-lab",
          "labId": "06",
          "runId": "fixture-06"
        }
      },
      "recordedAt": "2026-08-31T10:00:00Z",
      "lifecycleStatus": "active"
    },
    {
      "checkpointId": "LAB06-CP03",
      "kind": "azure-resource",
      "id": "/subscriptions/11111111-1111-4111-8111-111111111111/resourceGroups/rg-az104-l06-fixture-06/providers/Microsoft.Resources/deployments/cp3",
      "name": "fixture-06-3",
      "type": "Microsoft.Resources/deployments",
      "scope": null,
      "ownership": {
        "method": "manifest-id-and-tags",
        "expectedTags": {
          "purpose": "az104-lab",
          "labId": "06",
          "runId": "fixture-06"
        }
      },
      "recordedAt": "2026-08-31T10:00:00Z",
      "lifecycleStatus": "active"
    },
    {
      "checkpointId": "LAB06-CP04",
      "kind": "azure-resource",
      "id": "/subscriptions/11111111-1111-4111-8111-111111111111/resourceGroups/rg-az104-l06-fixture-06/providers/Microsoft.Resources/deployments/cp4",
      "name": "fixture-06-4",
      "type": "Microsoft.Resources/deployments",
      "scope": null,
      "ownership": {
        "method": "manifest-id-and-tags",
        "expectedTags": {
          "purpose": "az104-lab",
          "labId": "06",
          "runId": "fixture-06"
        }
      },
      "recordedAt": "2026-08-31T10:00:00Z",
      "lifecycleStatus": "active"
    },
    {
      "checkpointId": "LAB06-CP05",
      "kind": "azure-resource",
      "id": "/subscriptions/11111111-1111-4111-8111-111111111111/resourceGroups/rg-az104-l06-fixture-06/providers/Microsoft.Resources/deployments/cp5",
      "name": "fixture-06-5",
      "type": "Microsoft.Resources/deployments",
      "scope": null,
      "ownership": {
        "method": "manifest-id-and-tags",
        "expectedTags": {
          "purpose": "az104-lab",
          "labId": "06",
          "runId": "fixture-06"
        }
      },
      "recordedAt": "2026-08-31T10:00:00Z",
      "lifecycleStatus": "active"
    }
  ],
  "originalSettings": []
}
