{
  "schemaVersion": "1.0.0",
  "labId": "LAB-09",
  "runId": "fixture-09",
  "createdAt": "2026-08-31T10:00:00Z",
  "updatedAt": "2026-08-31T10:00:00Z",
  "status": "partial",
  "context": {
    "cloud": "AzureCloud",
    "tenantId": "22222222-2222-4222-8222-222222222222",
    "subscriptionId": "11111111-1111-4111-8111-111111111111"
  },
  "acknowledgements": {
    "cost": false,
    "tenantChange": true
  },
  "inputs": {
    "location": "westeurope"
  },
  "checkpointStates": [
    {
      "checkpointId": "LAB09-CP01",
      "required": true,
      "status": "pass",
      "updatedAt": "2026-08-31T10:00:00Z",
      "message": "Fixture checkpoint passed."
    },
    {
      "checkpointId": "LAB09-CP02",
      "required": true,
      "status": "pass",
      "updatedAt": "2026-08-31T10:00:00Z",
      "message": "Fixture checkpoint passed."
    },
    {
      "checkpointId": "LAB09-CP03",
      "required": true,
      "status": "pass",
      "updatedAt": "2026-08-31T10:00:00Z",
      "message": "Fixture checkpoint passed."
    },
    {
      "checkpointId": "LAB09-CP04",
      "required": false,
      "status": "skipped",
      "updatedAt": "2026-08-31T10:00:00Z",
      "message": "Fixture optional gate skipped."
    },
    {
      "checkpointId": "LAB09-CP05",
      "required": true,
      "status": "pass",
      "updatedAt": "2026-08-31T10:00:00Z",
      "message": "Fixture checkpoint passed."
    }
  ],
  "managedObjects": [
    {
      "checkpointId": "LAB09-CP01",
      "kind": "azure-resource",
      "id": "/subscriptions/11111111-1111-4111-8111-111111111111/resourceGroups/rg-az104-l09-fixture-09/providers/Microsoft.Resources/deployments/cp1",
      "name": "fixture-09-1",
      "type": "Microsoft.Resources/deployments",
      "scope": null,
      "ownership": {
        "method": "manifest-id-and-tags",
        "expectedTags": {
          "purpose": "az104-lab",
          "labId": "09",
          "runId": "fixture-09"
        }
      },
      "recordedAt": "2026-08-31T10:00:00Z",
      "lifecycleStatus": "active"
    },
    {
      "checkpointId": "LAB09-CP02",
      "kind": "azure-resource",
      "id": "/subscriptions/11111111-1111-4111-8111-111111111111/resourceGroups/rg-az104-l09-fixture-09/providers/Microsoft.Resources/deployments/cp2",
      "name": "fixture-09-2",
      "type": "Microsoft.Resources/deployments",
      "scope": null,
      "ownership": {
        "method": "manifest-id-and-tags",
        "expectedTags": {
          "purpose": "az104-lab",
          "labId": "09",
          "runId": "fixture-09"
        }
      },
      "recordedAt": "2026-08-31T10:00:00Z",
      "lifecycleStatus": "active"
    },
    {
      "checkpointId": "LAB09-CP03",
      "kind": "azure-resource",
      "id": "/subscriptions/11111111-1111-4111-8111-111111111111/resourceGroups/rg-az104-l09-fixture-09/providers/Microsoft.Resources/deployments/cp3",
      "name": "fixture-09-3",
      "type": "Microsoft.Resources/deployments",
      "scope": null,
      "ownership": {
        "method": "manifest-id-and-tags",
        "expectedTags": {
          "purpose": "az104-lab",
          "labId": "09",
          "runId": "fixture-09"
        }
      },
      "recordedAt": "2026-08-31T10:00:00Z",
      "lifecycleStatus": "active"
    },
    {
      "checkpointId": "LAB09-CP05",
      "kind": "azure-resource",
      "id": "/subscriptions/11111111-1111-4111-8111-111111111111/resourceGroups/rg-az104-l09-fixture-09/providers/Microsoft.Resources/deployments/cp5",
      "name": "fixture-09-5",
      "type": "Microsoft.Resources/deployments",
      "scope": null,
      "ownership": {
        "method": "manifest-id-and-tags",
        "expectedTags": {
          "purpose": "az104-lab",
          "labId": "09",
          "runId": "fixture-09"
        }
      },
      "recordedAt": "2026-08-31T10:00:00Z",
      "lifecycleStatus": "active"
    }
  ],
  "originalSettings": [
    {
      "checkpointId": "LAB09-CP01",
      "targetId": "22222222-2222-4222-8222-222222222222",
      "property": "tenant-change-baseline",
      "value": "recorded-before-mutation",
      "recordedAt": "2026-08-31T10:00:00Z"
    }
  ]
}
